### ISSUE TITLE
receivers may not properly apply flow control

### ISSUE THREAD

**Issue by olix0r** [carllerche/h2#65]
Here, we're looking at an h2 client talking to a grpc-go server:

Client sends a request:
```
   15   2.021388 55082 8888 HTTP2 173 HEADERS, DATA          ::1 → ::1         
Frame 15: 173 bytes on wire (1384 bits), 173 bytes captured (1384 bits) on interface 0
Null/Loopback
Internet Protocol Version 6, Src: ::1, Dst: ::1
Transmission Control Protocol, Src Port: 55082, Dst Port: 8888, Seq: 43, Ack: 32, Len: 97
HyperText Transfer Protocol 2
    Stream: HEADERS, Stream ID: 1, Length 70
        Length: 70
        Type: HEADERS (1)
        Flags: 0x04
            .... ...0 = End Stream: False
            .... .1.. = End Headers: True
```

server responds with headers:
```
   17   2.023249 8888 55082 HTTP2 99 HEADERS          ::1 → ::1         
Frame 17: 99 bytes on wire (792 bits), 99 bytes captured (792 bits) on interface 0
Null/Loopback
Internet Protocol Version 6, Src: ::1, Dst: ::1
Transmission Control Protocol, Src Port: 8888, Dst Port: 55082, Seq: 32, Ack: 140, Len: 23
HyperText Transfer Protocol 2
    Stream: HEADERS, Stream ID: 1, Length 14
        Length: 14
        Type: HEADERS (1)
        Flags: 0x04
            .... ...0 = End Stream: False
            .... .1.. = End Headers: True
```

server responds with data frames:
```
   20   2.023338 8888 55082 HTTP2 157 DATA          ::1 → ::1         
Frame 20: 157 bytes on wire (1256 bits), 157 bytes captured (1256 bits) on interface 0
Null/Loopback
Internet Protocol Version 6, Src: ::1, Dst: ::1
Transmission Control Protocol, Src Port: 8888, Dst Port: 55082, Seq: 16367, Ack: 140, Len: 81
[2 Reassembled TCP Segments (16393 bytes): #19(16312), #20(81)]
HyperText Transfer Protocol 2
    Stream: DATA, Stream ID: 1, Length 16384

   23   2.023411 8888 55082 HTTP2 157 DATA          ::1 → ::1         
Frame 23: 157 bytes on wire (1256 bits), 157 bytes captured (1256 bits) on interface 0
Null/Loopback
Internet Protocol Version 6, Src: ::1, Dst: ::1
Transmission Control Protocol, Src Port: 8888, Dst Port: 55082, Seq: 32760, Ack: 140, Len: 81
[2 Reassembled TCP Segments (16393 bytes): #22(16312), #23(81)]
HyperText Transfer Protocol 2
    Stream: DATA, Stream ID: 1, Length 16384

   26   2.023456 8888 55082 HTTP2 157 DATA          ::1 → ::1         
Frame 26: 157 bytes on wire (1256 bits), 157 bytes captured (1256 bits) on interface 0
Null/Loopback
Internet Protocol Version 6, Src: ::1, Dst: ::1
Transmission Control Protocol, Src Port: 8888, Dst Port: 55082, Seq: 49153, Ack: 140, Len: 81
[2 Reassembled TCP Segments (16393 bytes): #25(16312), #26(81)]
HyperText Transfer Protocol 2
    Stream: DATA, Stream ID: 1, Length 16384
        Length: 16384

   29   2.023491 8888 55082 HTTP2 156 DATA          ::1 → ::1         
Frame 29: 156 bytes on wire (1248 bits), 156 bytes captured (1248 bits) on interface 0
Null/Loopback
Internet Protocol Version 6, Src: ::1, Dst: ::1
Transmission Control Protocol, Src Port: 8888, Dst Port: 55082, Seq: 65546, Ack: 140, Len: 80
[2 Reassembled TCP Segments (16392 bytes): #28(16312), #29(80)]
HyperText Transfer Protocol 2
    Stream: DATA, Stream ID: 1, Length 16383
```

At this point the client's receive window (65535) is totally consumed!  So the client updates the windows after its flushed its data:
```
   31   2.028577 55082 8888 HTTP2 102 WINDOW_UPDATE, WINDOW_UPDATE          ::1 → ::1         
Frame 31: 102 bytes on wire (816 bits), 102 bytes captured (816 bits) on interface 0
Null/Loopback
Internet Protocol Version 6, Src: ::1, Dst: ::1
Transmission Control Protocol, Src Port: 55082, Dst Port: 8888, Seq: 140, Ack: 65626, Len: 26
HyperText Transfer Protocol 2
    Stream: WINDOW_UPDATE, Stream ID: 0, Length 4
        Length: 4
        Type: WINDOW_UPDATE (8)
        Flags: 0x00
            0000 0000 = Unused: 0x00
        0... .... .... .... .... .... .... .... = Reserved: 0x0
        .000 0000 0000 0000 0000 0000 0000 0000 = Stream Identifier: 0
        0... .... .... .... .... .... .... .... = Reserved: 0x0
        .000 0000 0000 0000 1111 1111 1111 1111 = Window Size Increment: 65535
    Stream: WINDOW_UPDATE, Stream ID: 1, Length 4
        Length: 4
        Type: WINDOW_UPDATE (8)
        Flags: 0x00
            0000 0000 = Unused: 0x00
        0... .... .... .... .... .... .... .... = Reserved: 0x0
        .000 0000 0000 0000 0000 0000 0000 0001 = Stream Identifier: 1
        0... .... .... .... .... .... .... .... = Reserved: 0x0
        .000 0000 0000 0000 1111 1111 1111 1111 = Window Size Increment: 65535
```

The server the sends just one more byte of data, and then trailers, to complete the response:
```
   33   2.028713 8888 55082 HTTP2 86 DATA          ::1 → ::1         
Frame 33: 86 bytes on wire (688 bits), 86 bytes captured (688 bits) on interface 0
Null/Loopback
Internet Protocol Version 6, Src: ::1, Dst: ::1
Transmission Control Protocol, Src Port: 8888, Dst Port: 55082, Seq: 65626, Ack: 166, Len: 10
HyperText Transfer Protocol 2
    Stream: DATA, Stream ID: 1, Length 1

   35   2.028943 8888 55082 HTTP2 109 HEADERS          ::1 → ::1         
Frame 35: 109 bytes on wire (872 bits), 109 bytes captured (872 bits) on interface 0
Null/Loopback
Internet Protocol Version 6, Src: ::1, Dst: ::1
Transmission Control Protocol, Src Port: 8888, Dst Port: 55082, Seq: 65636, Ack: 166, Len: 33
HyperText Transfer Protocol 2
    Stream: HEADERS, Stream ID: 1, Length 24
        Length: 24
        Type: HEADERS (1)
        Flags: 0x05
            .... ...1 = End Stream: True
            .... .1.. = End Headers: True
```

But the client isn't happy about this at all, and it fails incorrectly with a flow control error:
```
Frame 37: 93 bytes on wire (744 bits), 93 bytes captured (744 bits) on interface 0
Null/Loopback
Internet Protocol Version 6, Src: ::1, Dst: ::1
Transmission Control Protocol, Src Port: 55082, Dst Port: 8888, Seq: 166, Ack: 65669, Len: 17
HyperText Transfer Protocol 2
    Stream: GOAWAY, Stream ID: 0, Length 8
        Length: 8
        Type: GOAWAY (7)
        Flags: 0x00
            0000 0000 = Unused: 0x00
        0... .... .... .... .... .... .... .... = Reserved: 0x0
        .000 0000 0000 0000 0000 0000 0000 0000 = Stream Identifier: 0
        0... .... .... .... .... .... .... .... = Reserved: 0x0
        .000 0000 0000 0000 0000 0000 0000 0000 = Promised-Stream-ID: 0
        Error: FLOW_CONTROL_ERROR (3)
```

As the application fails, we see logging:
```
1504829194.779848 TRACE h2::proto::connection recv DATA; frame=Data { stream_id: StreamId(1), flags: DataFlags, pad_len: None }
1504829194.779860 TRACE h2::proto::streams::recv recv_data; size=1; connection=65535; stream=0
1504829194.779870 DEBUG h2::proto::connection Connection::poll; err=FlowControlError
```

This was all collected with  `:; tshark -i lo0 -PO http2 -d 'tcp.port==8888,http2' -f 'tcp port 8888`
<details>
<pre>
    1   0.000000 55082 8888 TCP 88 55082 → 8888 [SYN, ECN, CWR] Seq=0 Win=65535 Len=0 MSS=16324 WS=32 TSval=1346047041 TSecr=0 SACK_PERM=1          ::1 → ::1         
Frame 1: 88 bytes on wire (704 bits), 88 bytes captured (704 bits) on interface 0
Null/Loopback
Internet Protocol Version 6, Src: ::1, Dst: ::1
Transmission Control Protocol, Src Port: 55082, Dst Port: 8888, Seq: 0, Len: 0

    2   0.000083 8888 55082 TCP 88 8888 → 55082 [SYN, ACK] Seq=0 Ack=1 Win=65535 Len=0 MSS=16324 WS=32 TSval=1346047041 TSecr=1346047041 SACK_PERM=1          ::1 → ::1         
Frame 2: 88 bytes on wire (704 bits), 88 bytes captured (704 bits) on interface 0
Null/Loopback
Internet Protocol Version 6, Src: ::1, Dst: ::1
Transmission Control Protocol, Src Port: 8888, Dst Port: 55082, Seq: 0, Ack: 1, Len: 0

    3   0.000096 55082 8888 TCP 76 55082 → 8888 [ACK] Seq=1 Ack=1 Win=407776 Len=0 TSval=1346047041 TSecr=1346047041          ::1 → ::1         
Frame 3: 76 bytes on wire (608 bits), 76 bytes captured (608 bits) on interface 0
Null/Loopback
Internet Protocol Version 6, Src: ::1, Dst: ::1
Transmission Control Protocol, Src Port: 55082, Dst Port: 8888, Seq: 1, Ack: 1, Len: 0

    4   0.000111 8888 55082 TCP 76 [TCP Window Update] 8888 → 55082 [ACK] Seq=1 Ack=1 Win=407776 Len=0 TSval=1346047041 TSecr=1346047041          ::1 → ::1         
Frame 4: 76 bytes on wire (608 bits), 76 bytes captured (608 bits) on interface 0
Null/Loopback
Internet Protocol Version 6, Src: ::1, Dst: ::1
Transmission Control Protocol, Src Port: 8888, Dst Port: 55082, Seq: 1, Ack: 1, Len: 0

    5   0.000274 55082 8888 HTTP2 100 Magic          ::1 → ::1         
Frame 5: 100 bytes on wire (800 bits), 100 bytes captured (800 bits) on interface 0
Null/Loopback
Internet Protocol Version 6, Src: ::1, Dst: ::1
Transmission Control Protocol, Src Port: 55082, Dst Port: 8888, Seq: 1, Ack: 1, Len: 24
HyperText Transfer Protocol 2
    Stream: Magic
        Magic: PRI * HTTP/2.0\r\n\r\nSM\r\n\r\n

    6   0.000295 8888 55082 TCP 76 8888 → 55082 [ACK] Seq=1 Ack=25 Win=407776 Len=0 TSval=1346047041 TSecr=1346047041          ::1 → ::1         
Frame 6: 76 bytes on wire (608 bits), 76 bytes captured (608 bits) on interface 0
Null/Loopback
Internet Protocol Version 6, Src: ::1, Dst: ::1
Transmission Control Protocol, Src Port: 8888, Dst Port: 55082, Seq: 1, Ack: 25, Len: 0

    7   0.000314 8888 55082 HTTP2 85 SETTINGS          ::1 → ::1         
Frame 7: 85 bytes on wire (680 bits), 85 bytes captured (680 bits) on interface 0
Null/Loopback
Internet Protocol Version 6, Src: ::1, Dst: ::1
Transmission Control Protocol, Src Port: 8888, Dst Port: 55082, Seq: 1, Ack: 25, Len: 9
HyperText Transfer Protocol 2
    Stream: SETTINGS, Stream ID: 0, Length 0
        Length: 0
        Type: SETTINGS (4)
        Flags: 0x00
            .... ...0 = ACK: False
            0000 000. = Unused: 0x00
        0... .... .... .... .... .... .... .... = Reserved: 0x0
        .000 0000 0000 0000 0000 0000 0000 0000 = Stream Identifier: 0

    8   0.000331 55082 8888 TCP 76 55082 → 8888 [ACK] Seq=25 Ack=10 Win=407776 Len=0 TSval=1346047041 TSecr=1346047041          ::1 → ::1         
Frame 8: 76 bytes on wire (608 bits), 76 bytes captured (608 bits) on interface 0
Null/Loopback
Internet Protocol Version 6, Src: ::1, Dst: ::1
Transmission Control Protocol, Src Port: 55082, Dst Port: 8888, Seq: 25, Ack: 10, Len: 0

    9   0.000335 8888 55082 HTTP2 89 WINDOW_UPDATE          ::1 → ::1         
Frame 9: 89 bytes on wire (712 bits), 89 bytes captured (712 bits) on interface 0
Null/Loopback
Internet Protocol Version 6, Src: ::1, Dst: ::1
Transmission Control Protocol, Src Port: 8888, Dst Port: 55082, Seq: 10, Ack: 25, Len: 13
HyperText Transfer Protocol 2
    Stream: WINDOW_UPDATE, Stream ID: 0, Length 4
        Length: 4
        Type: WINDOW_UPDATE (8)
        Flags: 0x00
            0000 0000 = Unused: 0x00
        0... .... .... .... .... .... .... .... = Reserved: 0x0
        .000 0000 0000 0000 0000 0000 0000 0000 = Stream Identifier: 0
        0... .... .... .... .... .... .... .... = Reserved: 0x0
        .000 0000 0000 1110 1111 1111 1111 0001 = Window Size Increment: 983025

   10   0.000343 55082 8888 TCP 76 55082 → 8888 [ACK] Seq=25 Ack=23 Win=407776 Len=0 TSval=1346047041 TSecr=1346047041          ::1 → ::1         
Frame 10: 76 bytes on wire (608 bits), 76 bytes captured (608 bits) on interface 0
Null/Loopback
Internet Protocol Version 6, Src: ::1, Dst: ::1
Transmission Control Protocol, Src Port: 55082, Dst Port: 8888, Seq: 25, Ack: 23, Len: 0

   11   0.000940 55082 8888 HTTP2 94 SETTINGS, SETTINGS          ::1 → ::1         
Frame 11: 94 bytes on wire (752 bits), 94 bytes captured (752 bits) on interface 0
Null/Loopback
Internet Protocol Version 6, Src: ::1, Dst: ::1
Transmission Control Protocol, Src Port: 55082, Dst Port: 8888, Seq: 25, Ack: 23, Len: 18
HyperText Transfer Protocol 2
    Stream: SETTINGS, Stream ID: 0, Length 0
        Length: 0
        Type: SETTINGS (4)
        Flags: 0x00
            .... ...0 = ACK: False
            0000 000. = Unused: 0x00
        0... .... .... .... .... .... .... .... = Reserved: 0x0
        .000 0000 0000 0000 0000 0000 0000 0000 = Stream Identifier: 0
    Stream: SETTINGS, Stream ID: 0, Length 0
        Length: 0
        Type: SETTINGS (4)
        Flags: 0x01
            .... ...1 = ACK: True
            0000 000. = Unused: 0x00
        0... .... .... .... .... .... .... .... = Reserved: 0x0
        .000 0000 0000 0000 0000 0000 0000 0000 = Stream Identifier: 0

   12   0.000957 8888 55082 TCP 76 8888 → 55082 [ACK] Seq=23 Ack=43 Win=407744 Len=0 TSval=1346047042 TSecr=1346047042          ::1 → ::1         
Frame 12: 76 bytes on wire (608 bits), 76 bytes captured (608 bits) on interface 0
Null/Loopback
Internet Protocol Version 6, Src: ::1, Dst: ::1
Transmission Control Protocol, Src Port: 8888, Dst Port: 55082, Seq: 23, Ack: 43, Len: 0

   13   0.001033 8888 55082 HTTP2 85 SETTINGS          ::1 → ::1         
Frame 13: 85 bytes on wire (680 bits), 85 bytes captured (680 bits) on interface 0
Null/Loopback
Internet Protocol Version 6, Src: ::1, Dst: ::1
Transmission Control Protocol, Src Port: 8888, Dst Port: 55082, Seq: 23, Ack: 43, Len: 9
HyperText Transfer Protocol 2
    Stream: SETTINGS, Stream ID: 0, Length 0
        Length: 0
        Type: SETTINGS (4)
        Flags: 0x01
            .... ...1 = ACK: True
            0000 000. = Unused: 0x00
        0... .... .... .... .... .... .... .... = Reserved: 0x0
        .000 0000 0000 0000 0000 0000 0000 0000 = Stream Identifier: 0

   14   0.001056 55082 8888 TCP 76 55082 → 8888 [ACK] Seq=43 Ack=32 Win=407744 Len=0 TSval=1346047042 TSecr=1346047042          ::1 → ::1         
Frame 14: 76 bytes on wire (608 bits), 76 bytes captured (608 bits) on interface 0
Null/Loopback
Internet Protocol Version 6, Src: ::1, Dst: ::1
Transmission Control Protocol, Src Port: 55082, Dst Port: 8888, Seq: 43, Ack: 32, Len: 0

   15   2.021388 55082 8888 HTTP2 173 HEADERS, DATA          ::1 → ::1         
Frame 15: 173 bytes on wire (1384 bits), 173 bytes captured (1384 bits) on interface 0
Null/Loopback
Internet Protocol Version 6, Src: ::1, Dst: ::1
Transmission Control Protocol, Src Port: 55082, Dst Port: 8888, Seq: 43, Ack: 32, Len: 97
HyperText Transfer Protocol 2
    Stream: HEADERS, Stream ID: 1, Length 70
        Length: 70
        Type: HEADERS (1)
        Flags: 0x04
            .... ...0 = End Stream: False
            .... .1.. = End Headers: True
            .... 0... = Padded: False
            ..0. .... = Priority: False
            00.0 ..0. = Unused: 0x00
        0... .... .... .... .... .... .... .... = Reserved: 0x0
        .000 0000 0000 0000 0000 0000 0000 0001 = Stream Identifier: 1
        [Pad Length: 0]
        Header Block Fragment: 8387418aa0e41d139d09b8ebaebb048f6109b0a84afb4a8a...
        [Header Length: 194]
        [Header Count: 7]
        Header: :method: POST
            Name Length: 7
            Name: :method
            Value Length: 4
            Value: POST
            Representation: Indexed Header Field
            Index: 3
        Header: :scheme: https
            Name Length: 7
            Name: :scheme
            Value Length: 5
            Value: https
            Representation: Indexed Header Field
            Index: 7
        Header: :authority: localhost:7777
            Name Length: 10
            Name: :authority
            Value Length: 14
            Value: localhost:7777
            Representation: Literal Header Field with Incremental Indexing - Indexed Name
            Index: 1
        Header: :path: /strest.Responder/Get
            Name Length: 5
            Name: :path
            Value Length: 21
            Value: /strest.Responder/Get
            Representation: Literal Header Field without Indexing - Indexed Name
            Index: 4
        Header: content-type: application/grpc
            Name Length: 12
            Name: content-type
            Value Length: 16
            Value: application/grpc
            Representation: Literal Header Field with Incremental Indexing - Indexed Name
            Index: 31
        Header: user-agent: grpc-go/1.4.0-dev
            Name Length: 10
            Name: user-agent
            Value Length: 17
            Value: grpc-go/1.4.0-dev
            Representation: Literal Header Field with Incremental Indexing - Indexed Name
            Index: 58
        Header: te: trailers
            Name Length: 2
            Name: te
            Value Length: 8
            Value: trailers
            Representation: Literal Header Field with Incremental Indexing - New Name
        Padding: <MISSING>
    Stream: DATA, Stream ID: 1, Length 9
        Length: 9
        Type: DATA (0)
        Flags: 0x01
            .... ...1 = End Stream: True
            .... 0... = Padded: False
            0000 .00. = Unused: 0x00
        0... .... .... .... .... .... .... .... = Reserved: 0x0
        .000 0000 0000 0000 0000 0000 0000 0001 = Stream Identifier: 1
        [Pad Length: 0]
        Data: 000000000408edff03
        Padding: <MISSING>

   16   2.021431 8888 55082 TCP 76 8888 → 55082 [ACK] Seq=32 Ack=140 Win=407648 Len=0 TSval=1346049051 TSecr=1346049051          ::1 → ::1         
Frame 16: 76 bytes on wire (608 bits), 76 bytes captured (608 bits) on interface 0
Null/Loopback
Internet Protocol Version 6, Src: ::1, Dst: ::1
Transmission Control Protocol, Src Port: 8888, Dst Port: 55082, Seq: 32, Ack: 140, Len: 0

   17   2.023249 8888 55082 HTTP2 99 HEADERS          ::1 → ::1         
Frame 17: 99 bytes on wire (792 bits), 99 bytes captured (792 bits) on interface 0
Null/Loopback
Internet Protocol Version 6, Src: ::1, Dst: ::1
Transmission Control Protocol, Src Port: 8888, Dst Port: 55082, Seq: 32, Ack: 140, Len: 23
HyperText Transfer Protocol 2
    Stream: HEADERS, Stream ID: 1, Length 14
        Length: 14
        Type: HEADERS (1)
        Flags: 0x04
            .... ...0 = End Stream: False
            .... .1.. = End Headers: True
            .... 0... = Padded: False
            ..0. .... = Priority: False
            00.0 ..0. = Unused: 0x00
        0... .... .... .... .... .... .... .... = Reserved: 0x0
        .000 0000 0000 0000 0000 0000 0000 0001 = Stream Identifier: 1
        [Pad Length: 0]
        Header Block Fragment: 885f8b1d75d0620d263d4c4d6564
        [Header Length: 54]
        [Header Count: 2]
        Header: :status: 200
            Name Length: 7
            Name: :status
            Value Length: 3
            Value: 200
            Representation: Indexed Header Field
            Index: 8
        Header: content-type: application/grpc
            Name Length: 12
            Name: content-type
            Value Length: 16
            Value: application/grpc
            Representation: Literal Header Field with Incremental Indexing - Indexed Name
            Index: 31
        Padding: <MISSING>

   18   2.023281 55082 8888 TCP 76 55082 → 8888 [ACK] Seq=140 Ack=55 Win=407744 Len=0 TSval=1346049052 TSecr=1346049052          ::1 → ::1         
Frame 18: 76 bytes on wire (608 bits), 76 bytes captured (608 bits) on interface 0
Null/Loopback
Internet Protocol Version 6, Src: ::1, Dst: ::1
Transmission Control Protocol, Src Port: 55082, Dst Port: 8888, Seq: 140, Ack: 55, Len: 0

   19   2.023332 8888 55082 TCP 16388 [TCP segment of a reassembled PDU]          ::1 → ::1         
Frame 19: 16388 bytes on wire (131104 bits), 16388 bytes captured (131104 bits) on interface 0
Null/Loopback
Internet Protocol Version 6, Src: ::1, Dst: ::1
Transmission Control Protocol, Src Port: 8888, Dst Port: 55082, Seq: 55, Ack: 140, Len: 16312
HyperText Transfer Protocol 2

   20   2.023338 8888 55082 HTTP2 157 DATA          ::1 → ::1         
Frame 20: 157 bytes on wire (1256 bits), 157 bytes captured (1256 bits) on interface 0
Null/Loopback
Internet Protocol Version 6, Src: ::1, Dst: ::1
Transmission Control Protocol, Src Port: 8888, Dst Port: 55082, Seq: 16367, Ack: 140, Len: 81
[2 Reassembled TCP Segments (16393 bytes): #19(16312), #20(81)]
HyperText Transfer Protocol 2
    Stream: DATA, Stream ID: 1, Length 16384
        Length: 16384
        Type: DATA (0)
        Flags: 0x00
            .... ...0 = End Stream: False
            .... 0... = Padded: False
            0000 .00. = Unused: 0x00
        0... .... .... .... .... .... .... .... = Reserved: 0x0
        .000 0000 0000 0000 0000 0000 0000 0001 = Stream Identifier: 1
        [Pad Length: 0]
        Data: 000000fffb0aedff0378415767756a574276774676636943...
        Padding: <MISSING>

   21   2.023371 55082 8888 TCP 76 55082 → 8888 [ACK] Seq=140 Ack=16448 Win=391328 Len=0 TSval=1346049052 TSecr=1346049052          ::1 → ::1         
Frame 21: 76 bytes on wire (608 bits), 76 bytes captured (608 bits) on interface 0
Null/Loopback
Internet Protocol Version 6, Src: ::1, Dst: ::1
Transmission Control Protocol, Src Port: 55082, Dst Port: 8888, Seq: 140, Ack: 16448, Len: 0

   22   2.023405 8888 55082 TCP 16388 [TCP segment of a reassembled PDU]          ::1 → ::1         
Frame 22: 16388 bytes on wire (131104 bits), 16388 bytes captured (131104 bits) on interface 0
Null/Loopback
Internet Protocol Version 6, Src: ::1, Dst: ::1
Transmission Control Protocol, Src Port: 8888, Dst Port: 55082, Seq: 16448, Ack: 140, Len: 16312
HyperText Transfer Protocol 2

   23   2.023411 8888 55082 HTTP2 157 DATA          ::1 → ::1         
Frame 23: 157 bytes on wire (1256 bits), 157 bytes captured (1256 bits) on interface 0
Null/Loopback
Internet Protocol Version 6, Src: ::1, Dst: ::1
Transmission Control Protocol, Src Port: 8888, Dst Port: 55082, Seq: 32760, Ack: 140, Len: 81
[2 Reassembled TCP Segments (16393 bytes): #22(16312), #23(81)]
HyperText Transfer Protocol 2
    Stream: DATA, Stream ID: 1, Length 16384
        Length: 16384
        Type: DATA (0)
        Flags: 0x00
            .... ...0 = End Stream: False
            .... 0... = Padded: False
            0000 .00. = Unused: 0x00
        0... .... .... .... .... .... .... .... = Reserved: 0x0
        .000 0000 0000 0000 0000 0000 0000 0001 = Stream Identifier: 1
        [Pad Length: 0]
        Data: 614553766d48726d49775258424a454874515656536f6149...
        Padding: <MISSING>

   24   2.023446 55082 8888 TCP 76 55082 → 8888 [ACK] Seq=140 Ack=32841 Win=374944 Len=0 TSval=1346049052 TSecr=1346049052          ::1 → ::1         
Frame 24: 76 bytes on wire (608 bits), 76 bytes captured (608 bits) on interface 0
Null/Loopback
Internet Protocol Version 6, Src: ::1, Dst: ::1
Transmission Control Protocol, Src Port: 55082, Dst Port: 8888, Seq: 140, Ack: 32841, Len: 0

   25   2.023449 8888 55082 TCP 16388 [TCP segment of a reassembled PDU]          ::1 → ::1         
Frame 25: 16388 bytes on wire (131104 bits), 16388 bytes captured (131104 bits) on interface 0
Null/Loopback
Internet Protocol Version 6, Src: ::1, Dst: ::1
Transmission Control Protocol, Src Port: 8888, Dst Port: 55082, Seq: 32841, Ack: 140, Len: 16312
HyperText Transfer Protocol 2

   26   2.023456 8888 55082 HTTP2 157 DATA          ::1 → ::1         
Frame 26: 157 bytes on wire (1256 bits), 157 bytes captured (1256 bits) on interface 0
Null/Loopback
Internet Protocol Version 6, Src: ::1, Dst: ::1
Transmission Control Protocol, Src Port: 8888, Dst Port: 55082, Seq: 49153, Ack: 140, Len: 81
[2 Reassembled TCP Segments (16393 bytes): #25(16312), #26(81)]
HyperText Transfer Protocol 2
    Stream: DATA, Stream ID: 1, Length 16384
        Length: 16384
        Type: DATA (0)
        Flags: 0x00
            .... ...0 = End Stream: False
            .... 0... = Padded: False
            0000 .00. = Unused: 0x00
        0... .... .... .... .... .... .... .... = Reserved: 0x0
        .000 0000 0000 0000 0000 0000 0000 0001 = Stream Identifier: 1
        [Pad Length: 0]
        Data: 63737a534d644f48656647434d784d524f42685879594f71...
        Padding: <MISSING>

   27   2.023477 55082 8888 TCP 76 55082 → 8888 [ACK] Seq=140 Ack=49234 Win=358560 Len=0 TSval=1346049052 TSecr=1346049052          ::1 → ::1         
Frame 27: 76 bytes on wire (608 bits), 76 bytes captured (608 bits) on interface 0
Null/Loopback
Internet Protocol Version 6, Src: ::1, Dst: ::1
Transmission Control Protocol, Src Port: 55082, Dst Port: 8888, Seq: 140, Ack: 49234, Len: 0

   28   2.023486 8888 55082 TCP 16388 [TCP segment of a reassembled PDU]          ::1 → ::1         
Frame 28: 16388 bytes on wire (131104 bits), 16388 bytes captured (131104 bits) on interface 0
Null/Loopback
Internet Protocol Version 6, Src: ::1, Dst: ::1
Transmission Control Protocol, Src Port: 8888, Dst Port: 55082, Seq: 49234, Ack: 140, Len: 16312
HyperText Transfer Protocol 2

   29   2.023491 8888 55082 HTTP2 156 DATA          ::1 → ::1         
Frame 29: 156 bytes on wire (1248 bits), 156 bytes captured (1248 bits) on interface 0
Null/Loopback
Internet Protocol Version 6, Src: ::1, Dst: ::1
Transmission Control Protocol, Src Port: 8888, Dst Port: 55082, Seq: 65546, Ack: 140, Len: 80
[2 Reassembled TCP Segments (16392 bytes): #28(16312), #29(80)]
HyperText Transfer Protocol 2
    Stream: DATA, Stream ID: 1, Length 16383
        Length: 16383
        Type: DATA (0)
        Flags: 0x00
            .... ...0 = End Stream: False
            .... 0... = Padded: False
            0000 .00. = Unused: 0x00
        0... .... .... .... .... .... .... .... = Reserved: 0x0
        .000 0000 0000 0000 0000 0000 0000 0001 = Stream Identifier: 1
        [Pad Length: 0]
        Data: 4e6e465963446750796e7459796f71685964454171506542...
        Padding: <MISSING>

   30   2.023526 55082 8888 TCP 76 55082 → 8888 [ACK] Seq=140 Ack=65626 Win=342144 Len=0 TSval=1346049052 TSecr=1346049052          ::1 → ::1         
Frame 30: 76 bytes on wire (608 bits), 76 bytes captured (608 bits) on interface 0
Null/Loopback
Internet Protocol Version 6, Src: ::1, Dst: ::1
Transmission Control Protocol, Src Port: 55082, Dst Port: 8888, Seq: 140, Ack: 65626, Len: 0

   31   2.028577 55082 8888 HTTP2 102 WINDOW_UPDATE, WINDOW_UPDATE          ::1 → ::1         
Frame 31: 102 bytes on wire (816 bits), 102 bytes captured (816 bits) on interface 0
Null/Loopback
Internet Protocol Version 6, Src: ::1, Dst: ::1
Transmission Control Protocol, Src Port: 55082, Dst Port: 8888, Seq: 140, Ack: 65626, Len: 26
HyperText Transfer Protocol 2
    Stream: WINDOW_UPDATE, Stream ID: 0, Length 4
        Length: 4
        Type: WINDOW_UPDATE (8)
        Flags: 0x00
            0000 0000 = Unused: 0x00
        0... .... .... .... .... .... .... .... = Reserved: 0x0
        .000 0000 0000 0000 0000 0000 0000 0000 = Stream Identifier: 0
        0... .... .... .... .... .... .... .... = Reserved: 0x0
        .000 0000 0000 0000 1111 1111 1111 1111 = Window Size Increment: 65535
    Stream: WINDOW_UPDATE, Stream ID: 1, Length 4
        Length: 4
        Type: WINDOW_UPDATE (8)
        Flags: 0x00
            0000 0000 = Unused: 0x00
        0... .... .... .... .... .... .... .... = Reserved: 0x0
        .000 0000 0000 0000 0000 0000 0000 0001 = Stream Identifier: 1
        0... .... .... .... .... .... .... .... = Reserved: 0x0
        .000 0000 0000 0000 1111 1111 1111 1111 = Window Size Increment: 65535

   32   2.028616 8888 55082 TCP 76 8888 → 55082 [ACK] Seq=65626 Ack=166 Win=407616 Len=0 TSval=1346049057 TSecr=1346049056          ::1 → ::1         
Frame 32: 76 bytes on wire (608 bits), 76 bytes captured (608 bits) on interface 0
Null/Loopback
Internet Protocol Version 6, Src: ::1, Dst: ::1
Transmission Control Protocol, Src Port: 8888, Dst Port: 55082, Seq: 65626, Ack: 166, Len: 0

   33   2.028713 8888 55082 HTTP2 86 DATA          ::1 → ::1         
Frame 33: 86 bytes on wire (688 bits), 86 bytes captured (688 bits) on interface 0
Null/Loopback
Internet Protocol Version 6, Src: ::1, Dst: ::1
Transmission Control Protocol, Src Port: 8888, Dst Port: 55082, Seq: 65626, Ack: 166, Len: 10
HyperText Transfer Protocol 2
    Stream: DATA, Stream ID: 1, Length 1
        Length: 1
        Type: DATA (0)
        Flags: 0x00
            .... ...0 = End Stream: False
            .... 0... = Padded: False
            0000 .00. = Unused: 0x00
        0... .... .... .... .... .... .... .... = Reserved: 0x0
        .000 0000 0000 0000 0000 0000 0000 0001 = Stream Identifier: 1
        [Pad Length: 0]
        Data: 14
        Padding: <MISSING>

   34   2.028748 55082 8888 TCP 76 55082 → 8888 [ACK] Seq=166 Ack=65636 Win=342144 Len=0 TSval=1346049057 TSecr=1346049057          ::1 → ::1         
Frame 34: 76 bytes on wire (608 bits), 76 bytes captured (608 bits) on interface 0
Null/Loopback
Internet Protocol Version 6, Src: ::1, Dst: ::1
Transmission Control Protocol, Src Port: 55082, Dst Port: 8888, Seq: 166, Ack: 65636, Len: 0

   35   2.028943 8888 55082 HTTP2 109 HEADERS          ::1 → ::1         
Frame 35: 109 bytes on wire (872 bits), 109 bytes captured (872 bits) on interface 0
Null/Loopback
Internet Protocol Version 6, Src: ::1, Dst: ::1
Transmission Control Protocol, Src Port: 8888, Dst Port: 55082, Seq: 65636, Ack: 166, Len: 33
HyperText Transfer Protocol 2
    Stream: HEADERS, Stream ID: 1, Length 24
        Length: 24
        Type: HEADERS (1)
        Flags: 0x05
            .... ...1 = End Stream: True
            .... .1.. = End Headers: True
            .... 0... = Padded: False
            ..0. .... = Priority: False
            00.0 ..0. = Unused: 0x00
        0... .... .... .... .... .... .... .... = Reserved: 0x0
        .000 0000 0000 0000 0000 0000 0000 0001 = Stream Identifier: 1
        [Pad Length: 0]
        Header Block Fragment: 40889acac8b21234da8f013040899acac8b5254207317f00
        [Header Length: 40]
        [Header Count: 2]
        Header: grpc-status: 0
            Name Length: 11
            Name: grpc-status
            Value Length: 1
            Value: 0
            Representation: Literal Header Field with Incremental Indexing - New Name
        Header: grpc-message: 
            Name Length: 12
            Name: grpc-message
            Value Length: 0
            Value: 
            Representation: Literal Header Field with Incremental Indexing - New Name
        Padding: <MISSING>

   36   2.028982 55082 8888 TCP 76 55082 → 8888 [ACK] Seq=166 Ack=65669 Win=342112 Len=0 TSval=1346049057 TSecr=1346049057          ::1 → ::1         
Frame 36: 76 bytes on wire (608 bits), 76 bytes captured (608 bits) on interface 0
Null/Loopback
Internet Protocol Version 6, Src: ::1, Dst: ::1
Transmission Control Protocol, Src Port: 55082, Dst Port: 8888, Seq: 166, Ack: 65669, Len: 0

   37   2.029726 55082 8888 HTTP2 93 GOAWAY          ::1 → ::1         
Frame 37: 93 bytes on wire (744 bits), 93 bytes captured (744 bits) on interface 0
Null/Loopback
Internet Protocol Version 6, Src: ::1, Dst: ::1
Transmission Control Protocol, Src Port: 55082, Dst Port: 8888, Seq: 166, Ack: 65669, Len: 17
HyperText Transfer Protocol 2
    Stream: GOAWAY, Stream ID: 0, Length 8
        Length: 8
        Type: GOAWAY (7)
        Flags: 0x00
            0000 0000 = Unused: 0x00
        0... .... .... .... .... .... .... .... = Reserved: 0x0
        .000 0000 0000 0000 0000 0000 0000 0000 = Stream Identifier: 0
        0... .... .... .... .... .... .... .... = Reserved: 0x0
        .000 0000 0000 0000 0000 0000 0000 0000 = Promised-Stream-ID: 0
        Error: FLOW_CONTROL_ERROR (3)

   38   2.029759 8888 55082 TCP 76 8888 → 55082 [ACK] Seq=65669 Ack=183 Win=407616 Len=0 TSval=1346049058 TSecr=1346049058          ::1 → ::1         
Frame 38: 76 bytes on wire (608 bits), 76 bytes captured (608 bits) on interface 0
Null/Loopback
Internet Protocol Version 6, Src: ::1, Dst: ::1
Transmission Control Protocol, Src Port: 8888, Dst Port: 55082, Seq: 65669, Ack: 183, Len: 0

   39   2.032633 55082 8888 TCP 76 55082 → 8888 [FIN, ACK] Seq=183 Ack=65669 Win=342112 Len=0 TSval=1346049060 TSecr=1346049058          ::1 → ::1         
Frame 39: 76 bytes on wire (608 bits), 76 bytes captured (608 bits) on interface 0
Null/Loopback
Internet Protocol Version 6, Src: ::1, Dst: ::1
Transmission Control Protocol, Src Port: 55082, Dst Port: 8888, Seq: 183, Ack: 65669, Len: 0

   40   2.032679 8888 55082 TCP 76 8888 → 55082 [ACK] Seq=65669 Ack=184 Win=407616 Len=0 TSval=1346049060 TSecr=1346049060          ::1 → ::1         
Frame 40: 76 bytes on wire (608 bits), 76 bytes captured (608 bits) on interface 0
Null/Loopback
Internet Protocol Version 6, Src: ::1, Dst: ::1
Transmission Control Protocol, Src Port: 8888, Dst Port: 55082, Seq: 65669, Ack: 184, Len: 0

   41   2.032740 8888 55082 TCP 76 8888 → 55082 [FIN, ACK] Seq=65669 Ack=184 Win=407616 Len=0 TSval=1346049060 TSecr=1346049060          ::1 → ::1         
Frame 41: 76 bytes on wire (608 bits), 76 bytes captured (608 bits) on interface 0
Null/Loopback
Internet Protocol Version 6, Src: ::1, Dst: ::1
Transmission Control Protocol, Src Port: 8888, Dst Port: 55082, Seq: 65669, Ack: 184, Len: 0

   42   2.032783 55082 8888 TCP 76 55082 → 8888 [ACK] Seq=184 Ack=65670 Win=342112 Len=0 TSval=1346049060 TSecr=1346049060          ::1 → ::1         
Frame 42: 76 bytes on wire (608 bits), 76 bytes captured (608 bits) on interface 0
Null/Loopback
Internet Protocol Version 6, Src: ::1, Dst: ::1
Transmission Control Protocol, Src Port: 55082, Dst Port: 8888, Seq: 184, Ack: 65670, Len: 0
</pre>
</details>
