### ISSUE TITLE
panic: 'attempt to subtract with overflow'

### ISSUE THREAD

**Issue by olix0r** [carllerche/h2#110]
Triggered by running the following against an h2 server:

```
/usr/local/opt/curl/bin/curl --http2 --http2-prior-knowledge http://localhost:7777
```

<details>
<summary>RUST_LOG=h2::proto=trace</summary>
<pre>
1506195186.415549 TRACE h2::proto::streams::flow_control inc_window; sz=65535; old=0; new=65535
1506195186.415734 TRACE h2::proto::streams::flow_control inc_window; sz=65535; old=0; new=65535
1506195186.415819 TRACE h2::proto::streams::prioritize Prioritize::new; flow=FlowControl { window_size: 65535, available: 65535 }
1506195186.415898 TRACE h2::proto::settings send_pending_ack; pending=None
1506195186.416754 TRACE h2::proto::connection recv SETTINGS; frame=Settings { flags: SettingsFlags(0), header_table_size: None, enable_push: Some(0), max_concurrent_streams: Some(100), initial_window_size: Some(1073741824), max_frame_size: None, max_header_list_size: None }
1506195186.416808 TRACE h2::proto::settings send_pending_ack; pending=Some(Settings { flags: SettingsFlags(0), header_table_size: None, enable_push: Some(0), max_concurrent_streams: Some(100), initial_window_size: Some(1073741824), max_frame_size: None, max_header_list_size: None })
1506195186.416850 TRACE h2::proto::settings ACK sent; applying settings
1506195186.416920 TRACE h2::proto::connection recv WINDOW_UPDATE; frame=WindowUpdate { stream_id: StreamId(0), size_increment: 1073676289 }
1506195186.416962 TRACE h2::proto::streams::flow_control inc_window; sz=1073676289; old=65535; new=1073741824
1506195186.417012 TRACE h2::proto::settings send_pending_ack; pending=None
1506195186.418192 TRACE h2::proto::connection recv HEADERS; frame=Headers { stream_id: StreamId(1), stream_dep: None, flags: HeadersFlag { end_stream: true, end_headers: true, padded: false, priority: false } }
1506195186.418316 TRACE h2::proto::streams::flow_control inc_window; sz=65535; old=0; new=65535
1506195186.418357 TRACE h2::proto::streams::flow_control inc_window; sz=1073741824; old=0; new=1073741824
1506195186.418484 TRACE h2::proto::streams::streams recv_headers; stream=StreamId(1); state=State { inner: Idle }
1506195186.418538 TRACE h2::proto::streams::recv opening stream; init_window=65535
1506195186.418589 DEBUG h2::proto::connection Connection::poll; err=ProtocolError
1506195186.418631 TRACE h2::proto::streams::state recv_err; err=Proto(ProtocolError)
thread 'main' panicked at 'attempt to subtract with overflow', /Users/ver/.cargo/git/checkouts/h2-5627e19d2c95dbee/a72a6bc/src/proto/streams/counts.rs:141:13
stack backtrace:
   0: std::sys::imp::backtrace::tracing::imp::unwind_backtrace
   1: std::sys_common::backtrace::_print
   2: std::panicking::default_hook::{{closure}}
   3: std::panicking::default_hook
   4: std::panicking::rust_panic_with_hook
   5: std::panicking::begin_panic
   6: std::panicking::begin_panic_fmt
   7: rust_begin_unwind
   8: core::panicking::panic_fmt
   9: core::panicking::panic
  10: &lt;h2::proto::streams::counts::Counts&lt;P&gt;&gt;::dec_num_streams
  11: &lt;h2::proto::streams::counts::Counts&lt;P&gt;&gt;::transition_after
  12: &lt;h2::proto::streams::counts::Counts&lt;P&gt;&gt;::transition
  13: &lt;h2::proto::streams::streams::Streams&lt;B, P&gt;&gt;::recv_err::{{closure}}
  14: &lt;h2::proto::streams::store::Store&lt;B, P&gt;&gt;::for_each
  15: &lt;h2::proto::streams::streams::Streams&lt;B, P&gt;&gt;::recv_err
  16: &lt;h2::proto::connection::Connection&lt;T, P, B&gt;&gt;::poll
  17: &lt;h2::server::Server&lt;T, B&gt;&gt;::poll_close
  18: &lt;h2::server::Server&lt;T, B&gt; as futures::stream::Stream&gt;::poll
  19: &lt;futures::stream::fold::Fold&lt;S, F, Fut, T&gt; as futures::future::Future&gt;::poll
  20: &lt;futures::future::map_err::MapErr&lt;A, F&gt; as futures::future::Future&gt;::poll
  21: &lt;futures::future::chain::Chain&lt;A, B, C&gt;&gt;::poll
  22: &lt;futures::future::and_then::AndThen&lt;A, B, F&gt; as futures::future::Future&gt;::poll
  23: &lt;futures::future::map::Map&lt;A, F&gt; as futures::future::Future&gt;::poll
  24: &lt;futures::future::chain::Chain&lt;A, B, C&gt;&gt;::poll
  25: &lt;futures::future::and_then::AndThen&lt;A, B, F&gt; as futures::future::Future&gt;::poll
  26: &lt;alloc::boxed::Box&lt;F&gt; as futures::future::Future&gt;::poll
  27: &lt;tower_h2::server::ServeConnection as futures::future::Future&gt;::poll
  28: &lt;futures::future::map_err::MapErr&lt;A, F&gt; as futures::future::Future&gt;::poll
  29: &lt;alloc::boxed::Box&lt;F&gt; as futures::future::Future&gt;::poll
  30: &lt;futures::task_impl::Spawn&lt;F&gt;&gt;::poll_future_notify::{{closure}}
  31: &lt;futures::task_impl::Spawn&lt;T&gt;&gt;::enter::{{closure}}
  32: futures::task_impl::std::set
  33: &lt;futures::task_impl::Spawn&lt;T&gt;&gt;::enter
  34: &lt;futures::task_impl::Spawn&lt;F&gt;&gt;::poll_future_notify
  35: tokio_core::reactor::Core::dispatch_task::{{closure}}
  36: &lt;scoped_tls::ScopedKey&lt;T&gt;&gt;::set
  37: tokio_core::reactor::Core::dispatch_task
  38: tokio_core::reactor::Core::dispatch
  39: tokio_core::reactor::Core::poll
  40: tokio_core::reactor::Core::run
  41: buoxy::main
  42: __rust_maybe_catch_panic
  43: std::rt::lang_start
  44: main
</pre>
</details>

<details>
<summary>tshark output</summary>
<pre>
Transmission Control Protocol, Src Port: 7777, Dst Port: 55059, Seq: 1, Ack: 1, Len: 9
HyperText Transfer Protocol 2
    Stream: SETTINGS, Stream ID: 0, Length 0
        Length: 0
        Type: SETTINGS (4)
        Flags: 0x00
            .... ...0 = ACK: False
            0000 000. = Unused: 0x00
        0... .... .... .... .... .... .... .... = Reserved: 0x0
        .000 0000 0000 0000 0000 0000 0000 0000 = Stream Identifier: 0

Transmission Control Protocol, Src Port: 55059, Dst Port: 7777, Seq: 25, Ack: 10, Len: 27
HyperText Transfer Protocol 2
    Stream: SETTINGS, Stream ID: 0, Length 18
        Length: 18
        Type: SETTINGS (4)
        Flags: 0x00
            .... ...0 = ACK: False
            0000 000. = Unused: 0x00
        0... .... .... .... .... .... .... .... = Reserved: 0x0
        .000 0000 0000 0000 0000 0000 0000 0000 = Stream Identifier: 0
        Settings - Max concurrent streams : 100
            Settings Identifier: Max concurrent streams (3)
            Max concurrent streams: 100
        Settings - Initial Windows size : 1073741824
            Settings Identifier: Initial Windows size (4)
            Initial Windows Size: 1073741824
        Settings - Enable PUSH : 0
            Settings Identifier: Enable PUSH (2)
            Enable PUSH: 0

Transmission Control Protocol, Src Port: 55059, Dst Port: 7777, Seq: 52, Ack: 10, Len: 13
HyperText Transfer Protocol 2
    Stream: WINDOW_UPDATE, Stream ID: 0, Length 4
        Length: 4
        Type: WINDOW_UPDATE (8)
        Flags: 0x00
            0000 0000 = Unused: 0x00
        0... .... .... .... .... .... .... .... = Reserved: 0x0
        .000 0000 0000 0000 0000 0000 0000 0000 = Stream Identifier: 0
        0... .... .... .... .... .... .... .... = Reserved: 0x0
        .011 1111 1111 1111 0000 0000 0000 0001 = Window Size Increment: 1073676289

Transmission Control Protocol, Src Port: 55059, Dst Port: 7777, Seq: 65, Ack: 10, Len: 39
HyperText Transfer Protocol 2
    Stream: HEADERS, Stream ID: 1, Length 30
        Length: 30
        Type: HEADERS (1)
        Flags: 0x05
            .... ...1 = End Stream: True
            .... .1.. = End Headers: True
            .... 0... = Padded: False
            ..0. .... = Priority: False
            00.0 ..0. = Unused: 0x00
        0... .... .... .... .... .... .... .... = Reserved: 0x0
        .000 0000 0000 0000 0000 0000 0000 0001 = Stream Identifier: 1
        [Pad Length: 0]
        Header Block Fragment: 828486418aa0e41d139d09b8ebaebb7a8825b650c3abb6da...
        [Header Length: 129]
        [Header Count: 6]
        Header: :method: GET
            Name Length: 7
            Name: :method
            Value Length: 3
            Value: GET
            Representation: Indexed Header Field
            Index: 2
        Header: :path: /
            Name Length: 5
            Name: :path
            Value Length: 1
            Value: /
            Representation: Indexed Header Field
            Index: 4
        Header: :scheme: http
            Name Length: 7
            Name: :scheme
            Value Length: 4
            Value: http
            Representation: Indexed Header Field
            Index: 6
        Header: :authority: localhost:7777
            Name Length: 10
            Name: :authority
            Value Length: 14
            Value: localhost:7777
            Representation: Literal Header Field with Incremental Indexing - Indexed Name
            Index: 1
        Header: user-agent: curl/7.55.1
            Name Length: 10
            Name: user-agent
            Value Length: 11
            Value: curl/7.55.1
            Representation: Literal Header Field with Incremental Indexing - Indexed Name
            Index: 58
        Header: accept: */*
            Name Length: 6
            Name: accept
            Value Length: 3
            Value: */*
            Representation: Literal Header Field with Incremental Indexing - Indexed Name
            Index: 19
        Padding: <MISSING>

Transmission Control Protocol, Src Port: 55059, Dst Port: 7777, Seq: 104, Ack: 10, Len: 9
HyperText Transfer Protocol 2
    Stream: SETTINGS, Stream ID: 0, Length 0
        Length: 0
        Type: SETTINGS (4)
        Flags: 0x01
            .... ...1 = ACK: True
            0000 000. = Unused: 0x00
        0... .... .... .... .... .... .... .... = Reserved: 0x0
        .000 0000 0000 0000 0000 0000 0000 0000 = Stream Identifier: 0
</pre>
</details>

**Comment by olix0r** [comment]
I think there are two separate issues here:

1. Stream ID accounting is buggy, which causes the connection to go into protocol error and go away.
2. Go away handling is also buggy, which causes the panic.

More on stream id accounting bug, in `h2::proto::streams::recv`:

```rust

    /// Update state reflecting a new, remotely opened stream
    ///
    /// Returns the stream state if successful. `None` if refused
    pub fn open(
        &mut self,
        id: StreamId,
        counts: &mut Counts<P>,
    ) -> Result<Option<StreamId>, RecvError> {
        assert!(self.refused.is_none());

        self.ensure_can_open(id)?;

        let next_id = self.next_stream_id()?;
        if id < next_id {
            return Err(RecvError::Connection(ProtocolError));
        }

        self.next_stream_id = id.next_id();

        if !counts.can_inc_num_recv_streams() {
            self.refused = Some(id);
            return Ok(None);
        }

        Ok(Some(id))
    }

    /// Transition the stream state based on receiving headers
    ///
    /// The caller ensures that the frame represents headers and not trailers.
    pub fn recv_headers(
        &mut self,
        frame: frame::Headers,
        stream: &mut store::Ptr<B, P>,
        counts: &mut Counts<P>,
    ) -> Result<(), RecvError> {
        trace!("opening stream; init_window={}", self.init_window_sz);
        let is_initial = stream.state.recv_open(frame.is_end_stream())?;

        if is_initial {
            let id = frame.stream_id();
            let next_id = self.next_stream_id()?;
            if id >= next_id {
                self.next_stream_id = id.next_id();
            } else {
                error!("invalid id: {:?} < {:?}", id, next_id);
                return Err(RecvError::Connection(ProtocolError));
            }

            ...
```

Both `open` and `recv_headers` attempt to update `self.next_stream_id`, which causes newly received headers to be interpreted as invalid.

In `h2::proto::streams::streams::Streams::recv_headers`, we see that both `Recv::open` and `Recv::recv_headers` are called as a stream is initialized:

```rust
    /// Process inbound headers
    pub fn recv_headers(&mut self, frame: frame::Headers) -> Result<(), RecvError> {
        let id = frame.stream_id();
        let mut me = self.inner.lock().unwrap();
        let me = &mut *me;

        let key = match me.store.find_entry(id) {
            Entry::Occupied(e) => e.key(),
            Entry::Vacant(e) => match me.actions.recv.open(id, &mut me.counts)? {
                Some(stream_id) => {
                    let stream = Stream::new(
                        stream_id,
                        me.actions.send.init_window_sz(),
                        me.actions.recv.init_window_sz(),
                    );

                    e.insert(stream)
                },
                None => return Ok(()),
            },
        };

        let stream = me.store.resolve(key);
        let actions = &mut me.actions;

        me.counts.transition(stream, |counts, stream| {
            trace!(
                "recv_headers; stream={:?}; state={:?}",
                stream.id,
                stream.state
            );

            let res = if stream.state.is_recv_headers() {
                actions.recv.recv_headers(frame, stream, counts)
            } else ...
```

So, it seems that at least one of the following should be changed:

1. `open` should not update the next stream id
2. `recv_headers` should not check the next stream id
3. the `is_initial` checkin recv_headers is wrong

I think this also means we must not be testing the Streams::recv_headers call path.

**Comment by olix0r** [comment]
https://github.com/carllerche/h2/commit/d0bb3cb20d51eb7b87264a250dddc7ecedb3bdd1 implements a serverside test that illustrates this problem.
